{"catalogue_id":"mathhead.proof-strategy-catalogue.v1","guarantees_success":false,"mathematical_authority":false,"policy":"exact structural admissibility hints only; no ranking, execution, success, or authority claim","strategies":[{"description":"A truth-constant obligation may be handled by a future exact truth-constant capability.","match_axis":"obligation_kind","match_rule_id":"mh.strategy-match.kind.truth","match_values":["truth"],"reason_code":"EXACT_TRUTH_KIND","strategy_id":"mh.strategy.truth-constant"},{"description":"An equality obligation may be offered to a future exact equality capability.","match_axis":"relation_kind","match_rule_id":"mh.strategy-match.relation.equal","match_values":["equal"],"reason_code":"EXACT_EQUAL_RELATION","strategy_id":"mh.strategy.equality"},{"description":"A disequality obligation may be offered to a future exact disequality capability.","match_axis":"relation_kind","match_rule_id":"mh.strategy-match.relation.not-equal","match_values":["not_equal"],"reason_code":"EXACT_NOT_EQUAL_RELATION","strategy_id":"mh.strategy.disequality"},{"description":"An ordered comparison may be offered to a future ordered-relation capability.","match_axis":"relation_kind","match_rule_id":"mh.strategy-match.relation.order","match_values":["greater","greater_equal","less","less_equal"],"reason_code":"EXACT_ORDER_RELATION","strategy_id":"mh.strategy.ordered-relation"},{"description":"A membership or nonmembership obligation may be offered to a future membership capability.","match_axis":"relation_kind","match_rule_id":"mh.strategy-match.relation.membership","match_values":["member","not_member"],"reason_code":"EXACT_MEMBERSHIP_RELATION","strategy_id":"mh.strategy.membership"},{"description":"A divisibility obligation may be offered to a future exact divisibility capability.","match_axis":"relation_kind","match_rule_id":"mh.strategy-match.relation.divides","match_values":["divides"],"reason_code":"EXACT_DIVIDES_RELATION","strategy_id":"mh.strategy.divisibility"},{"description":"A congruence obligation may be offered to a future exact congruence capability.","match_axis":"relation_kind","match_rule_id":"mh.strategy-match.relation.congruent","match_values":["congruent"],"reason_code":"EXACT_CONGRUENT_RELATION","strategy_id":"mh.strategy.congruence"},{"description":"A named predicate obligation may be offered only to a future predicate-aware capability.","match_axis":"relation_kind","match_rule_id":"mh.strategy-match.relation.predicate","match_values":["predicate"],"reason_code":"EXACT_PREDICATE_RELATION","strategy_id":"mh.strategy.named-predicate"},{"description":"Logical structural parents may be composed only after their explicit child duties are handled.","match_axis":"obligation_kind","match_rule_id":"mh.strategy-match.kind.structural","match_values":["biconditional","conjunction","implication","universal"],"reason_code":"EXACT_STRUCTURAL_KIND","strategy_id":"mh.strategy.structural-composition"},{"description":"A disjunction exposes explicit alternatives for a future caller-owned case choice.","match_axis":"obligation_kind","match_rule_id":"mh.strategy-match.kind.case-choice","match_values":["disjunction"],"reason_code":"EXACT_DISJUNCTION_KIND","strategy_id":"mh.strategy.case-choice"},{"description":"Existential and witness duties may be offered to a future witness-construction capability.","match_axis":"obligation_kind","match_rule_id":"mh.strategy-match.kind.witness","match_values":["existential","unique_existence","witness_construction","witness_search"],"reason_code":"EXACT_WITNESS_KIND","strategy_id":"mh.strategy.witness-construction"},{"description":"A uniqueness component may be offered to a future uniqueness-reasoning capability.","match_axis":"obligation_kind","match_rule_id":"mh.strategy-match.kind.uniqueness","match_values":["uniqueness"],"reason_code":"EXACT_UNIQUENESS_KIND","strategy_id":"mh.strategy.uniqueness"},{"description":"A refutation obligation may be offered to a future counterexample-search capability.","match_axis":"goal_mode","match_rule_id":"mh.strategy-match.mode.refute","match_values":["refute"],"reason_code":"EXACT_REFUTE_MODE","strategy_id":"mh.strategy.counterexample-search"},{"description":"A compute obligation may be offered to a future exact-computation capability.","match_axis":"goal_mode","match_rule_id":"mh.strategy-match.mode.compute","match_values":["compute"],"reason_code":"EXACT_COMPUTE_MODE","strategy_id":"mh.strategy.exact-computation"},{"description":"A classify obligation may be offered to a future classification capability.","match_axis":"goal_mode","match_rule_id":"mh.strategy-match.mode.classify","match_values":["classify"],"reason_code":"EXACT_CLASSIFY_MODE","strategy_id":"mh.strategy.classification"},{"description":"An optimize obligation may be offered to a future optimization capability.","match_axis":"goal_mode","match_rule_id":"mh.strategy-match.mode.optimize","match_values":["optimize"],"reason_code":"EXACT_OPTIMIZE_MODE","strategy_id":"mh.strategy.optimization"},{"description":"A target touching a finite domain may additionally admit future bounded enumeration.","match_axis":"domain_kind","match_rule_id":"mh.strategy-match.domain.finite","match_values":["finite"],"reason_code":"EXACT_FINITE_DOMAIN_DEPENDENCY","strategy_id":"mh.strategy.finite-enumeration"},{"description":"A target touching a modular domain may additionally admit future modular reasoning.","match_axis":"domain_kind","match_rule_id":"mh.strategy-match.domain.modular","match_values":["modular"],"reason_code":"EXACT_MODULAR_DOMAIN_DEPENDENCY","strategy_id":"mh.strategy.modular-domain"},{"description":"A target touching an exact builtin numeric carrier may additionally admit future numeric reasoning.","match_axis":"builtin_carrier","match_rule_id":"mh.strategy-match.carrier.numeric","match_values":["complex","integer","natural","rational","real"],"reason_code":"EXACT_NUMERIC_CARRIER_DEPENDENCY","strategy_id":"mh.strategy.numeric-domain"}],"schema":"mathhead.proof-strategy-catalogue.v1"}
